{
  "$schema": "./node_modules/karfia-definition/index.json",
  "id": "solana:test-validator/solana-test-validator:1.17.26",
  "caip2": "solana:test-validator",
  "name": "Solana Test Validator",
  "containers": {
    "solana-test-validator": {
      "image": "ghcr.io/fuxingloh/solana-container:1.17.26",
      "source": "https://github.com/fuxingloh/solana-container",
      "resources": {
        "cpu": 0.25,
        "memory": 256
      },
      "endpoints": {
        "rpc": {
          "port": 8899,
          "protocol": "HTTP JSON-RPC 2.0",
          "probes": {
            "readiness": {
              "params": [],
              "method": "getBlockHeight",
              "match": {
                "result": {
                  "type": "number"
                }
              }
            }
          }
        }
      }
    }
  }
}
