{
  "$schema": "./node_modules/karfia-definition/index.json",
  "id": "bip122:d744db74fb70ed42767ae028a129365f/defichain:4.0.1/jellyfishsdk:4.0.5",
  "caip2": "bip122:d744db74fb70ed42767ae028a129365f",
  "name": "DeFiChain Regtest (defid and whale)",
  "containers": {
    "defid": {
      "image": "docker.io/defi/defichain@sha256:ddb70eabe4d7337f570e779378e7c453c5ec2a3ee7c3c050f285edf24789eb5a",
      "source": "https://github.com/DeFiCh/ain",
      "endpoints": {
        "p2p": {
          "port": 19555
        },
        "rpc": {
          "port": 19554,
          "protocol": "HTTP JSON-RPC 2.0",
          "authorization": {
            "type": "HttpBasic",
            "username": "RPCUSER",
            "password": "RPCPASSWORD"
          },
          "probes": {
            "readiness": {
              "method": "getblockchaininfo",
              "params": [],
              "match": {
                "result": {
                  "type": "object",
                  "properties": {
                    "blocks": {
                      "type": "number"
                    }
                  },
                  "required": ["blocks"]
                }
              }
            }
          }
        }
      },
      "resources": {
        "cpu": 0.25,
        "memory": 256
      },
      "command": [
        "defid",
        "-maxconnections=512",
        "-printtoconsole",
        "-rpcallowip=0.0.0.0/0",
        "-rpcbind=0.0.0.0",
        "-rpcuser=RPCUSER",
        "-rpcpassword=RPCPASSWORD",
        "-txindex=1",
        "-acindex=1",
        "-regtest=1",
        "-jellyfish_regtest=1",
        "-txnotokens=0",
        "-amkheight=0",
        "-bayfrontheight=1",
        "-bayfrontgardensheight=2",
        "-clarkequayheight=3",
        "-dakotaheight=4",
        "-dakotacrescentheight=5",
        "-eunosheight=6",
        "-eunospayaheight=7",
        "-fortcanningheight=8"
      ],
      "volumes": {
        "persistent": {
          "paths": ["/data"],
          "size": "1G"
        }
      }
    },
    "whale": {
      "image": "ghcr.io/birthdayresearch/whale-api:4.0.5@sha256:1afc855ab5790572096de198473bd372d91fc7ba3caf65f618cc3076c6a86649",
      "source": "https://github.com/BirthdayResearch/jellyfishsdk",
      "endpoints": {
        "api": {
          "port": 3000,
          "protocol": "HTTP REST",
          "probes": {
            "readiness": {
              "method": "GET",
              "path": "/_actuator/probes/liveness",
              "match": {
                "status": 200
              }
            }
          }
        }
      },
      "environment": {
        "WHALE_DEFID_URL": "http://RPCUSER:RPCPASSWORD@defid:19554",
        "WHALE_NETWORK": "regtest",
        "WHALE_VERSION": "v0"
      },
      "resources": {
        "cpu": 0.25,
        "memory": 256
      }
    }
  }
}
